{
  "schema_version": "1.0",
  "document_id": "m1g-dpi300",
  "sources": [
    {
      "source_id": "src000",
      "asset_path": "page00.png",
      "file_sha256": "b7d47625d1dd0cc006efb64ea371728faddd8ecf98a0c72fd1f49759c0d455d5",
      "kind": "image"
    },
    {
      "source_id": "src001",
      "asset_path": "page01.png",
      "file_sha256": "8257b009d774caedfe0408222c5640c1d3476f84078b9f657cd360d46f6f44fa",
      "kind": "image"
    },
    {
      "source_id": "src002",
      "asset_path": "page02.png",
      "file_sha256": "034a03f22465fa69d0aa3d1cc4c0355d527dc27812efdea7780c3d97e341b819",
      "kind": "image"
    },
    {
      "source_id": "src003",
      "asset_path": "page03.png",
      "file_sha256": "fc48a06bf6b951218f7501cad540b48fe71912ac9aceecdfc4642774f40c2e4f",
      "kind": "image"
    },
    {
      "source_id": "src004",
      "asset_path": "page04.png",
      "file_sha256": "d0a3549ecc7b6602e666f0a88d49804815dedc50945e9c06f3c0ca8b3d21df00",
      "kind": "image"
    },
    {
      "source_id": "src005",
      "asset_path": "page05.png",
      "file_sha256": "0018c47b9394d14b9ecb1624ca3a5f0bb50cd2c6863353e48c4785a7ae526a49",
      "kind": "image"
    },
    {
      "source_id": "src006",
      "asset_path": "page06.png",
      "file_sha256": "aa84c14269467d4ac46166358ff2e0db83a6662fdfd6b636a5f338c8ddbe6168",
      "kind": "image"
    },
    {
      "source_id": "src007",
      "asset_path": "page07.png",
      "file_sha256": "16cdc1e703894f74cfaa94a286c57e8d2884a2d7c0c3a197c71b741259892aa5",
      "kind": "image"
    }
  ],
  "pages": [
    {
      "page_id": "p00",
      "source_id": "src000",
      "source_page_index": 0,
      "ocr_page_path": "page00.ocr.json",
      "ocr_page_sha256": "7bb5f4f3502fe99e47fe2eaa60cccc2424eacf972736f1ad9a142186bf9e9b19"
    },
    {
      "page_id": "p01",
      "source_id": "src001",
      "source_page_index": 0,
      "ocr_page_path": "page01.ocr.json",
      "ocr_page_sha256": "2ad85f7d8447358f23717b7d40970fd01b4e73f3b757d0ed6ecd17d63efeaba9"
    },
    {
      "page_id": "p02",
      "source_id": "src002",
      "source_page_index": 0,
      "ocr_page_path": "page02.ocr.json",
      "ocr_page_sha256": "2b54338ed5b796f72a69eaf4463cdaa24b541997b83e85fa3f6ebc14f6c0de0f"
    },
    {
      "page_id": "p03",
      "source_id": "src003",
      "source_page_index": 0,
      "ocr_page_path": "page03.ocr.json",
      "ocr_page_sha256": "0076667e87eba707d21b19f6cef61ec2cb820f5859548202512f95f3840946ec"
    },
    {
      "page_id": "p04",
      "source_id": "src004",
      "source_page_index": 0,
      "ocr_page_path": "page04.ocr.json",
      "ocr_page_sha256": "d6ba8944e4a27e534ce3bf7d203a4b71b9f8cacc610a768b65207510d2f22747"
    },
    {
      "page_id": "p05",
      "source_id": "src005",
      "source_page_index": 0,
      "ocr_page_path": "page05.ocr.json",
      "ocr_page_sha256": "699563012de3cb3e517ef86221e8c17c01b9f84603118bc984ed88af48705c26"
    },
    {
      "page_id": "p06",
      "source_id": "src006",
      "source_page_index": 0,
      "ocr_page_path": "page06.ocr.json",
      "ocr_page_sha256": "45acccf1d531dfff8ab46801f1270e2a90bdd0312d62a86c82e519965f36ea24"
    },
    {
      "page_id": "p07",
      "source_id": "src007",
      "source_page_index": 0,
      "ocr_page_path": "page07.ocr.json",
      "ocr_page_sha256": "003c07d46af01b3d209726da54a9f0b6a9d938be7860a749511edb8bec61b8d5"
    }
  ]
}
